{
  "schema_version": "0.1.0",
  "titulo": "Ciclo XXIII — A Caatinga habitada: água, trabalho, memória e vizinhança",
  "estado": "expansao_cultural_proposta_sem_canonizacao",
  "aprovacao_autoral": false,
  "efeito_canonico_automatico": false,
  "regiao_id": "regiao:caatinga",
  "regiao_vizinha_id": "regiao:costa-sul",
  "regiao_geografica_documentada": true,
  "lugares_canonicos_adicionados": 0,
  "fronteira_exata_documentada": null,
  "populacao_documentada": null,
  "agua_potavel_confirmada": null,
  "governo_regional_confirmado": null,
  "fonte_manuscrito": "fontes/autoria/hack-carcaca-dw-capitulo-i.paginas.json",
  "fontes_preexistentes": [
    "data/regioes_carcaca.json",
    "data/dinamicas_territoriais_alem_sul.json",
    "data/propostas/caatinga-rede-social-hack.json",
    "data/propostas/fronteira-caatinga-costa-sul-hack.json"
  ],
  "metrica_editorial": "12 pontos amparados em manuscrito e 40 propostas sociais novas; reaproveita referências hipotéticas existentes sem converter NPC, poço, mercado ou rota em cânone.",
  "limite_de_escopo": [
    "Os conflitos com pradarias são regionais; nenhum ataque individual a Portomonte foi documentado.",
    "Orcs da Caatinga não são todos saqueadores; humanos também não são todos agricultores da costa.",
    "Não criar povoado, fonte de água, clima, vazão, potabilidade, espécie agrícola, população nem coordenadas.",
    "Não impor nomadismo, clã ou profissão militar como universal a orcs ou exilados da Caatinga.",
    "Não atribuir comércio direto comprovado entre Portomonte e a Caatinga.",
    "A purificação em Portomonte viabiliza agricultura; não demonstra água para beber nem abastecimento do interior.",
    "Kuo-toa/abissais marinhos não são demônios do Abismo e suas incursões diferem de pilhagens terrestres.",
    "A aliança de 351 EC não estabelece tratado ou autoridade presente.",
    "A memória de guerra pode ser plural sem inventar memorial oficial.",
    "Propostas prévias de poço, feira, NPCs e rota continuam apenas propostas; nenhum encontro de campanha ocorreu.",
    "Não se deduz religião da Caatinga pela origem geográfica ou ancestralidade.",
    "Não modificar fichas de criaturas, regras DW, arquivos factuais de regiões e lugares, nem a revisão XIX."
  ],
  "fatos_documentados": [
    {
      "id": "worldbuilding-xxiii:fato:caatinga-reconhecida",
      "afirmacao_de_fonte": "O Além Sul inclui terras de Caatinga e uma costa associada ao Mar de Sangue.",
      "pagina_manuscrito": 5,
      "limite_de_inferencia": "Não fixar limite, cidade ou hidrografia.",
      "estado": "fonte_autoral_em_revisao",
      "canon_novo": false
    },
    {
      "id": "worldbuilding-xxiii:fato:sem-ocupacao-direta",
      "afirmacao_de_fonte": "O Além Sul não está ocupado diretamente pelos elfos das sombras nos moldes descritos para outros territórios.",
      "pagina_manuscrito": 5,
      "limite_de_inferencia": "Não deduzir paz, autonomia legal universal nem imunidade a influência indireta.",
      "estado": "fonte_autoral_em_revisao",
      "canon_novo": false
    },
    {
      "id": "worldbuilding-xxiii:fato:grupos-dispersos",
      "afirmacao_de_fonte": "O manuscrito descreve populações espalhadas por terras áridas e pela costa.",
      "pagina_manuscrito": 5,
      "limite_de_inferencia": "Não deduzir nomadismo universal.",
      "estado": "fonte_autoral_em_revisao",
      "canon_novo": false
    },
    {
      "id": "worldbuilding-xxiii:fato:conflitos-regionais",
      "afirmacao_de_fonte": "Exilados das terras áridas e sobreviventes agrícolas das pradarias da Costa Sul entram em guerras e pilhagens frequentes.",
      "pagina_manuscrito": 5,
      "limite_de_inferencia": "Não atribuir uma incursão a Portomonte ou a uma pessoa.",
      "estado": "fonte_autoral_em_revisao",
      "canon_novo": false
    },
    {
      "id": "worldbuilding-xxiii:fato:grupos-plurais",
      "afirmacao_de_fonte": "Orcs, humanos e criaturas do mar vivem no Além Sul, em contextos diferentes.",
      "pagina_manuscrito": 5,
      "limite_de_inferencia": "Não descrever todos como membros de um mesmo clã ou facção.",
      "estado": "fonte_autoral_em_revisao",
      "canon_novo": false
    },
    {
      "id": "worldbuilding-xxiii:fato:portomonte-comercio",
      "afirmacao_de_fonte": "Portomonte é um grande assentamento humano costeiro, protegido por penhascos e importante para o comércio entre assentamentos da costa.",
      "pagina_manuscrito": 5,
      "limite_de_inferencia": "Não afirmar comércio direto com a Caatinga.",
      "estado": "fonte_autoral_em_revisao",
      "canon_novo": false
    },
    {
      "id": "worldbuilding-xxiii:fato:demeter-agricultura",
      "afirmacao_de_fonte": "Em Portomonte, um templo de Deméter purifica o Mar de Sangue e possibilita agricultura sobre a pedra.",
      "pagina_manuscrito": 5,
      "limite_de_inferencia": "Não inferir água potável para beber nem infraestrutura de irrigação da Caatinga.",
      "estado": "fonte_autoral_em_revisao",
      "canon_novo": false
    },
    {
      "id": "worldbuilding-xxiii:fato:separar-ataques",
      "afirmacao_de_fonte": "Kuo-toa e abissais marinhos praticam ataques de captura sacrificial na costa e ilhas, distintos das pilhagens terrestres.",
      "pagina_manuscrito": 5,
      "limite_de_inferencia": "Não confundir abissais marinhos com demônios do Abismo ocidental.",
      "estado": "fonte_autoral_em_revisao",
      "canon_novo": false
    },
    {
      "id": "worldbuilding-xxiii:fato:antiga-alianca",
      "afirmacao_de_fonte": "Em 351 EC, clãs orcs se uniram a humanos de Garganta para derrotar a invasão kuo-toa.",
      "pagina_manuscrito": 9,
      "limite_de_inferencia": "Não transformar aliança de 351 em tratado vigente no presente.",
      "estado": "fonte_autoral_em_revisao",
      "canon_novo": false
    },
    {
      "id": "worldbuilding-xxiii:fato:presenca-humana",
      "afirmacao_de_fonte": "Há humanos vivendo na Caatinga, no Rio Ancestral e especialmente na Costa Sul.",
      "pagina_manuscrito": 12,
      "limite_de_inferencia": "Não fixar proporções de população.",
      "estado": "fonte_autoral_em_revisao",
      "canon_novo": false
    },
    {
      "id": "worldbuilding-xxiii:fato:orcs-caatinga",
      "afirmacao_de_fonte": "Orcs possuem longa presença nas terras áridas do Além Sul; grupos vivem pela Caatinga e perto da costa.",
      "pagina_manuscrito": 12,
      "limite_de_inferencia": "Não atribuir a todos os orcs a prática de pilhagem.",
      "estado": "fonte_autoral_em_revisao",
      "canon_novo": false
    },
    {
      "id": "worldbuilding-xxiii:fato:inimizades-e-aliancas",
      "afirmacao_de_fonte": "Humanos e orcs podem estar em lados opostos de conflitos regionais ou colaborar diante de ameaças marítimas.",
      "pagina_manuscrito": 12,
      "limite_de_inferencia": "Não uniformizar a política de povos inteiros.",
      "estado": "fonte_autoral_em_revisao",
      "canon_novo": false
    }
  ],
  "referencias_a_propostas_e_dados_existentes": [
    {
      "id": "caatinga:comunidade:poco-sem-bandeira",
      "arquivo": "data/propostas/caatinga-rede-social-hack.json",
      "colecao": "comunidades",
      "precaucao": "Proposta de encontro em torno de poço, NÃO local no atlas factual."
    },
    {
      "id": "caatinga:comunidade:feira-ferragens",
      "arquivo": "data/propostas/caatinga-rede-social-hack.json",
      "colecao": "comunidades",
      "precaucao": "Feira hipotética; NÃO mercado confirmado."
    },
    {
      "id": "caatinga:comunidade:patio-cabacas",
      "arquivo": "data/propostas/caatinga-rede-social-hack.json",
      "colecao": "comunidades",
      "precaucao": "Hipótese de governança de recipientes; sem volume real."
    },
    {
      "id": "caatinga:comunidade:baixio-sementes",
      "arquivo": "data/propostas/caatinga-rede-social-hack.json",
      "colecao": "comunidades",
      "precaucao": "Estoque de sementes hipotético; sem cultivo confirmado."
    },
    {
      "id": "caatinga:comunidade:pedra-nove-silencios",
      "arquivo": "data/propostas/caatinga-rede-social-hack.json",
      "colecao": "comunidades",
      "precaucao": "Memorial hipotético sobre memória de guerra."
    },
    {
      "id": "caatinga:rota:barro-e-ferragem",
      "arquivo": "data/propostas/caatinga-rede-social-hack.json",
      "colecao": "rotas",
      "precaucao": "Rota hipotética sem coordenadas."
    },
    {
      "id": "dinamica:pilhagens-caatinga-pradarias",
      "arquivo": "data/dinamicas_territoriais_alem_sul.json",
      "colecao": "dinamicas",
      "precaucao": "Fato regional, sem perpetradores particulares."
    },
    {
      "id": "dinamica:ataques-liturgicos-costa-ilhas",
      "arquivo": "data/dinamicas_territoriais_alem_sul.json",
      "colecao": "dinamicas",
      "precaucao": "Ataques marítimos, não a mesma dinâmica das pilhagens terrestres."
    },
    {
      "id": "dinamica:nao-ocupacao-direta-alem-sul",
      "arquivo": "data/dinamicas_territoriais_alem_sul.json",
      "colecao": "dinamicas",
      "precaucao": "Sem ocupação direta não equivale a ausência de influência."
    },
    {
      "id": "lugar:portomonte",
      "arquivo": "data/lugares_carcaca.json",
      "colecao": "lugares",
      "precaucao": "Portomonte é lugar factual da Costa Sul, não da Caatinga."
    },
    {
      "id": "regiao:caatinga",
      "arquivo": "data/regioes_carcaca.json",
      "colecao": "regioes",
      "precaucao": "Âncora regional com limites imprecisos."
    },
    {
      "id": "regiao:costa-sul",
      "arquivo": "data/regioes_carcaca.json",
      "colecao": "regioes",
      "precaucao": "Região vizinha, sem linha fronteiriça conhecida."
    }
  ],
  "dominios_sociais": [
    {
      "id": "worldbuilding-xxiii:dominios_sociais:cuidado-e-vizinhanca",
      "nome_editorial": "Quem cuida quando a viagem falha?",